<?xml version="1.0" encoding="UTF-8"?>
<mmlFcl:FirstClinicModule
  xmlns:mmlFcl="http://www.medxml.net/MML/v4/ContentModule/FirstClinic/1.0"
  xmlns:mmlRd="http://www.medxml.net/MML/v4/ContentModule/RegisteredDiagnosis/1.0"
  xmlns:mmlFc="http://www.medxml.net/MML/v4/SharedComponent/Facility/1.0"
  xmlns:xsi="http://www.w3.org/2001/XMLSchema-instance"
  xsi:schemaLocation="http://www.medxml.net/MML/v4/ContentModule/FirstClinic/1.0 ../firstclinic.xsd"
  xmlns:xhtml="http://www.w3.org/1999/xhtml">
  <mmlFcl:familyHistory>
    <mmlFcl:familyHistoryItem>
      <mmlFcl:relation>motherInLaw</mmlFcl:relation>
      <mmlRd:RegisteredDiagnosisModule>
        <mmlRd:diagnosis mmlRd:code="C169-.007" mmlRd:system="ICD10">gastric cancer</mmlRd:diagnosis>
        <mmlRd:endDate>1989-08-25</mmlRd:endDate>
        <mmlRd:outcome>died</mmlRd:outcome>
      </mmlRd:RegisteredDiagnosisModule>
      <mmlFcl:age>P40Y</mmlFcl:age>
    </mmlFcl:familyHistoryItem>
  </mmlFcl:familyHistory>
  <mmlFcl:childhood>
    <mmlFcl:birthInfo>
      <mmlFcl:deliveryWeeks>P40W</mmlFcl:deliveryWeeks>
      <mmlFcl:deliveryMethod>cesarean section</mmlFcl:deliveryMethod>
      <mmlFcl:bodyWeight mmlFcl:unit="g">3270</mmlFcl:bodyWeight>
      <mmlFcl:bodyHeight mmlFcl:unit="cm">50</mmlFcl:bodyHeight>
    </mmlFcl:birthInfo>
  </mmlFcl:childhood>
  <mmlFcl:vaccination>
    <mmlFcl:vaccinationItem>
      <mmlFcl:vaccine>polio</mmlFcl:vaccine>
      <mmlFcl:injected>true</mmlFcl:injected>
      <mmlFcl:age>P6M</mmlFcl:age>
      <mmlFcl:memo>first administration</mmlFcl:memo>
    </mmlFcl:vaccinationItem>
    <mmlFcl:vaccinationItem>
      <mmlFcl:vaccine>polio</mmlFcl:vaccine>
      <mmlFcl:injected>true</mmlFcl:injected>
      <mmlFcl:age>P1Y6M</mmlFcl:age>
      <mmlFcl:memo>second administration</mmlFcl:memo>
    </mmlFcl:vaccinationItem>
  </mmlFcl:vaccination>
  <mmlFcl:pastHistory>
    <mmlFcl:pastHistoryItem>
      <mmlFcl:timeExpression>6 years old</mmlFcl:timeExpression>
      <mmlFcl:eventExpression>appendectomy</mmlFcl:eventExpression>
    </mmlFcl:pastHistoryItem>
    <mmlFcl:pastHistoryItem>
      <mmlFcl:timeExpression>5 years ago (1994)</mmlFcl:timeExpression>
      <mmlFcl:eventExpression>hypertension</mmlFcl:eventExpression>
    </mmlFcl:pastHistoryItem>
  </mmlFcl:pastHistory>
  <mmlFcl:chiefComplaints>頭痛</mmlFcl:chiefComplaints>
  <mmlFcl:presentIllnessNotes>2週間前より一日に数回側頭部から頭頂部にかけてのずきずきする痛みがあり。</mmlFcl:presentIllnessNotes>
</mmlFcl:FirstClinicModule>
